<?xml version="1.0" encoding="UTF-8"?>
<!--Sample XML file generated by XMLSpy v2008 rel. 2 sp1 (http://www.altova.com)-->
<Form3Info xsi:noNamespaceSchemaLocation="Form3Data.xsd" xmlns:xsi="http://www.w3.org/2001/XMLSchema-instance">
	<InsiderRecord>
		<AccessionNumber>0001179110-11-008696 </AccessionNumber>
		<MSCompanyID>10</MSCompanyID>
		<CompanyName>Aon Corp.</CompanyName>
		<FilingType>3</FilingType>
		<PeriodEndDate>2010-06-30</PeriodEndDate>
		<FilingDate>2011-05-26</FilingDate>
		<IssuerCIK>315293</IssuerCIK>
		<GlobalPersonId>PS00000ZNT</GlobalPersonId>
		<RptOwnerCIK>1332706</RptOwnerCIK>
		<RptFirstName>Kristi</RptFirstName>
		<RptMiddleName></RptMiddleName>
		<RptLastName>Savacool</RptLastName>
		<RptFullName>Kristi Savacool</RptFullName>
		<RptOwnerStreet>AON CORPORATION - CORPORATE LAW DEPT 200 EAST RANDOLPH STREET 8TH FLOOR</RptOwnerStreet>
		<RptOwnerCity>CHICAGO</RptOwnerCity>
		<RptOwnerState>IL</RptOwnerState>
		<RptOwnerZipCode>60601</RptOwnerZipCode>
		<IsDirector>N</IsDirector>
		<IsOfficer>Y</IsOfficer>
		<IsTenPercentOwner>N</IsTenPercentOwner>
		<IsOther>N</IsOther>
		<Relationship>CEO - Aon Hewitt</Relationship>		
	</InsiderRecord>
		<InsiderRecord>
		<AccessionNumber>0001022871-11-000001</AccessionNumber>
		<MSCompanyID>0C0000189Q</MSCompanyID>
		<CompanyName>Axiom Gold &amp; Silver Corp</CompanyName>
		<FilingType>3</FilingType>
		<PeriodEndDate>2010-09-30</PeriodEndDate>
		<FilingDate>2011-01-14</FilingDate>
		<IssuerCIK>1022871</IssuerCIK>
		<GlobalPersonId>PS00001G0F</GlobalPersonId>
		<RptOwnerCIK>1399095</RptOwnerCIK>
		<RptFirstName>Robert</RptFirstName>
		<RptMiddleName></RptMiddleName>
		<RptLastName>Knight</RptLastName>
		<RptFullName>Robert Knight</RptFullName>
		<RptOwnerStreet>1075 MARINE DRIVE, SUITE 155</RptOwnerStreet>
		<RptOwnerCity>NORTH VANCOUVER</RptOwnerCity>
		<RptOwnerState>A1</RptOwnerState>
		<RptOwnerZipCode></RptOwnerZipCode>
		<IsDirector>N</IsDirector>
		<IsOfficer>N</IsOfficer>
		<IsTenPercentOwner>Y</IsTenPercentOwner>
		<IsOther>N</IsOther>
		<Relationship>Ten Percent Owner</Relationship>		
	</InsiderRecord>
</Form3Info>
