<?xml version="1.0" encoding="UTF-8"?>
<!--Sample XML file generated by XMLSpy v2008 rel. 2 sp1 (http://www.altova.com)-->
<Form3Info xsi:noNamespaceSchemaLocation="Form3Data.xsd" xmlns:xsi="http://www.w3.org/2001/XMLSchema-instance">
	<InsiderRecord>
		<AccessionNumber>0001179110-11-008696 </AccessionNumber>
		<MSCompanyID>10</MSCompanyID>
		<CompanyName>Aon Corp.</CompanyName>
		<FilingDate>2011-05-26</FilingDate>
		<IssuerCIK>0000315293</IssuerCIK>
		<GlobalPersonId>PS00000ZNT</GlobalPersonId>
		<RptOwnerCIK>0001332706</RptOwnerCIK>
		<RptFirstName>Kristi</RptFirstName>
		<RptMiddleName></RptMiddleName>
		<RptLastName>Savacool</RptLastName>
		<RptFullName>Kristi Savacool</RptFullName>
		<RptOwnerStreet>AON CORPORATION - CORPORATE LAW DEPT 200 EAST RANDOLPH STREET 8TH FLOOR</RptOwnerStreet>
		<RptOwnerCity>CHICAGO</RptOwnerCity>
		<RptOwnerState>IL</RptOwnerState>
		<RptOwnerZipCode>60601</RptOwnerZipCode>
		<IsDirector>false</IsDirector>
		<IsOfficer>true</IsOfficer>
		<IsTenPercentOwner>false</IsTenPercentOwner>
		<IsOther>false</IsOther>
		<Relationship>CEO - Aon Hewitt</OfficerTitle>		
	</InsiderRecord>
		<InsiderRecord>
		<AccessionNumber>0001022871-11-000001</AccessionNumber>
		<MSCompanyID>0C0000189Q</MSCompanyID>
		<CompanyName>Axiom Gold & Silver Corp</CompanyName>
		<FilingDate>2011-01-14</FilingDate>
		<IssuerCIK>0001022871</IssuerCIK>
		<GlobalPersonId>PS00001G0F</GlobalPersonId>
		<RptOwnerCIK>0001399095</RptOwnerCIK>
		<RptFirstName>Robert</RptFirstName>
		<RptMiddleName></RptMiddleName>
		<RptLastName>Knight</RptLastName>
		<RptFullName>Robert Knight</RptFullName>
		<RptOwnerStreet>1075 MARINE DRIVE, SUITE 155</RptOwnerStreet>
		<RptOwnerCity>NORTH VANCOUVER</RptOwnerCity>
		<RptOwnerState>A1</RptOwnerState>
		<RptOwnerZipCode></RptOwnerZipCode>
		<IsDirector>false</IsDirector>
		<IsOfficer>false</IsOfficer>
		<IsTenPercentOwner>true</IsTenPercentOwner>
		<IsOther>false</IsOther>
		<Relationship>Ten Percent Owner</OfficerTitle>		
	</InsiderRecord>
</Form3Info>
